slug,nombre,url,descripcion
ciudad-nantes,"Château des Ducs de Bretagne","ducks-de-bretagne.php","El gran castillo urbano de Nantes, sede del Museo de Historia."
ciudad-nantes,"Château de Goulaine","goulaine.php","Castillo–viñedo histórico entre marismas, uno de los más antiguos abiertos al público."
ciudad-nantes,"Château de Clisson","clisson.php","Fortaleza medieval con estética italiana en pleno Valle del Sèvre."
ciudad-nantes,"Château d’Oudon","oudon.php","Impresionante torre medieval con vistas panorámicas sobre el Loira."
ciudad-nantes,"Château de Châteaubriant","chateaubriant.php","Castillo que combina fortaleza medieval y palacio renacentista."
ciudad-nantes,"Château de Serrant","serrant.php","Castillo refinado famoso por su mobiliario y estancias históricas, cerca de Angers."