slug,desc
"Nantes","Capital cultural del oeste francés. Hogar de <em>Les Machines de l'île</em> y del castillo de los Duques de Bretaña."
"Angers","Ciudad medieval famosa por su imponente castillo y el Tapiz del Apocalipsis, la obra textil medieval más grande del mundo."
"Saumur","Elegante ciudad junto al Loira, conocida por sus vinos espumosos y su escuela de equitación <em>Cadre Noir</em>."
"Tours","Ciudad universitaria y vibrante, punto de partida perfecto para recorrer los castillos del Valle del Loira."
"Blois","Encantadora ciudad histórica con calles medievales y el <em>Château Royal de Blois</em>, antiguo hogar de reyes franceses."
"Orleans","Ciudad estrechamente ligada a Juana de Arco; catedral gótica, plazas amplias y paseos junto al Loira."